{
  "$schema": "https://json-schema.org/draft/2020-12/schema",
  "type": "object",
  "properties": {
    "version": {
      "type": "number",
      "const": 1
    },
    "generatedAt": {
      "type": "string",
      "format": "date-time",
      "pattern": "^(?:(?:\\d\\d[2468][048]|\\d\\d[13579][26]|\\d\\d0[48]|[02468][048]00|[13579][26]00)-02-29|\\d{4}-(?:(?:0[13578]|1[02])-(?:0[1-9]|[12]\\d|3[01])|(?:0[469]|11)-(?:0[1-9]|[12]\\d|30)|(?:02)-(?:0[1-9]|1\\d|2[0-8])))T(?:(?:[01]\\d|2[0-3]):[0-5]\\d(?::[0-5]\\d(?:\\.\\d+)?)?(?:Z))$"
    },
    "incidents": {
      "type": "array",
      "items": {
        "type": "object",
        "properties": {
          "number": {
            "type": "integer",
            "minimum": -9007199254740991,
            "maximum": 9007199254740991
          },
          "title": {
            "type": "string"
          },
          "monitorId": {
            "type": "string"
          },
          "stage": {
            "type": "string",
            "enum": [
              "investigating",
              "identified",
              "monitoring",
              "resolved"
            ]
          },
          "startedAt": {
            "type": "string",
            "format": "date-time",
            "pattern": "^(?:(?:\\d\\d[2468][048]|\\d\\d[13579][26]|\\d\\d0[48]|[02468][048]00|[13579][26]00)-02-29|\\d{4}-(?:(?:0[13578]|1[02])-(?:0[1-9]|[12]\\d|3[01])|(?:0[469]|11)-(?:0[1-9]|[12]\\d|30)|(?:02)-(?:0[1-9]|1\\d|2[0-8])))T(?:(?:[01]\\d|2[0-3]):[0-5]\\d(?::[0-5]\\d(?:\\.\\d+)?)?(?:Z))$"
          },
          "resolvedAt": {
            "anyOf": [
              {
                "type": "string",
                "format": "date-time",
                "pattern": "^(?:(?:\\d\\d[2468][048]|\\d\\d[13579][26]|\\d\\d0[48]|[02468][048]00|[13579][26]00)-02-29|\\d{4}-(?:(?:0[13578]|1[02])-(?:0[1-9]|[12]\\d|3[01])|(?:0[469]|11)-(?:0[1-9]|[12]\\d|30)|(?:02)-(?:0[1-9]|1\\d|2[0-8])))T(?:(?:[01]\\d|2[0-3]):[0-5]\\d(?::[0-5]\\d(?:\\.\\d+)?)?(?:Z))$"
              },
              {
                "type": "null"
              }
            ]
          },
          "durationMinutes": {
            "anyOf": [
              {
                "type": "integer",
                "minimum": 0,
                "maximum": 9007199254740991
              },
              {
                "type": "null"
              }
            ]
          },
          "updates": {
            "type": "array",
            "items": {
              "type": "object",
              "properties": {
                "at": {
                  "type": "string",
                  "format": "date-time",
                  "pattern": "^(?:(?:\\d\\d[2468][048]|\\d\\d[13579][26]|\\d\\d0[48]|[02468][048]00|[13579][26]00)-02-29|\\d{4}-(?:(?:0[13578]|1[02])-(?:0[1-9]|[12]\\d|3[01])|(?:0[469]|11)-(?:0[1-9]|[12]\\d|30)|(?:02)-(?:0[1-9]|1\\d|2[0-8])))T(?:(?:[01]\\d|2[0-3]):[0-5]\\d(?::[0-5]\\d(?:\\.\\d+)?)?(?:Z))$"
                },
                "author": {
                  "type": "string"
                },
                "kind": {
                  "type": "string",
                  "enum": [
                    "opened",
                    "comment",
                    "stage",
                    "resolved"
                  ]
                },
                "body": {
                  "type": "string"
                },
                "stage": {
                  "type": "string",
                  "enum": [
                    "investigating",
                    "identified",
                    "monitoring",
                    "resolved"
                  ]
                }
              },
              "required": [
                "at",
                "author",
                "kind",
                "body"
              ]
            }
          }
        },
        "required": [
          "number",
          "title",
          "monitorId",
          "stage",
          "startedAt",
          "resolvedAt",
          "durationMinutes",
          "updates"
        ]
      }
    },
    "maintenances": {
      "type": "array",
      "items": {
        "type": "object",
        "properties": {
          "number": {
            "type": "integer",
            "minimum": -9007199254740991,
            "maximum": 9007199254740991
          },
          "title": {
            "type": "string"
          },
          "state": {
            "type": "string",
            "enum": [
              "scheduled",
              "active",
              "completed",
              "cancelled"
            ]
          },
          "start": {
            "type": "string",
            "format": "date-time",
            "pattern": "^(?:(?:\\d\\d[2468][048]|\\d\\d[13579][26]|\\d\\d0[48]|[02468][048]00|[13579][26]00)-02-29|\\d{4}-(?:(?:0[13578]|1[02])-(?:0[1-9]|[12]\\d|3[01])|(?:0[469]|11)-(?:0[1-9]|[12]\\d|30)|(?:02)-(?:0[1-9]|1\\d|2[0-8])))T(?:(?:[01]\\d|2[0-3]):[0-5]\\d(?::[0-5]\\d(?:\\.\\d+)?)?(?:Z))$"
          },
          "end": {
            "type": "string",
            "format": "date-time",
            "pattern": "^(?:(?:\\d\\d[2468][048]|\\d\\d[13579][26]|\\d\\d0[48]|[02468][048]00|[13579][26]00)-02-29|\\d{4}-(?:(?:0[13578]|1[02])-(?:0[1-9]|[12]\\d|3[01])|(?:0[469]|11)-(?:0[1-9]|[12]\\d|30)|(?:02)-(?:0[1-9]|1\\d|2[0-8])))T(?:(?:[01]\\d|2[0-3]):[0-5]\\d(?::[0-5]\\d(?:\\.\\d+)?)?(?:Z))$"
          },
          "monitors": {
            "type": "array",
            "items": {
              "type": "string"
            }
          },
          "updates": {
            "type": "array",
            "items": {
              "type": "object",
              "properties": {
                "at": {
                  "type": "string",
                  "format": "date-time",
                  "pattern": "^(?:(?:\\d\\d[2468][048]|\\d\\d[13579][26]|\\d\\d0[48]|[02468][048]00|[13579][26]00)-02-29|\\d{4}-(?:(?:0[13578]|1[02])-(?:0[1-9]|[12]\\d|3[01])|(?:0[469]|11)-(?:0[1-9]|[12]\\d|30)|(?:02)-(?:0[1-9]|1\\d|2[0-8])))T(?:(?:[01]\\d|2[0-3]):[0-5]\\d(?::[0-5]\\d(?:\\.\\d+)?)?(?:Z))$"
                },
                "author": {
                  "type": "string"
                },
                "kind": {
                  "type": "string",
                  "enum": [
                    "opened",
                    "comment",
                    "stage",
                    "resolved"
                  ]
                },
                "body": {
                  "type": "string"
                },
                "stage": {
                  "type": "string",
                  "enum": [
                    "investigating",
                    "identified",
                    "monitoring",
                    "resolved"
                  ]
                }
              },
              "required": [
                "at",
                "author",
                "kind",
                "body"
              ]
            }
          }
        },
        "required": [
          "number",
          "title",
          "state",
          "start",
          "end",
          "monitors",
          "updates"
        ]
      }
    }
  },
  "required": [
    "version",
    "generatedAt",
    "incidents",
    "maintenances"
  ]
}
